{
  "schema_version": "1.0",
  "generated_at": "2026-09-01T07:11:42Z",
  "source": "https://xian.app",
  "count": 18,
  "apps": [
    {
      "id": "47aa80e6-4927-4dd4-b332-5e459b1ccc48",
      "name": "Grok Bot 玩法全景手册",
      "tagline": "Grok Bot 玩法全景手册",
      "description": "Grok Bot 是 xAI 与 Cursor 联合发布的云端多智能体办公平台，每个 Bot 拥有独立的持久云电脑，能以「像人一样操作界面」的方式登录用户授权的应用和网站完成工作。合上电脑、关掉手机后 Bot 仍继续运行。核心玩法包括总监模式调度任务、Routine 流程自动化、以及哨兵/流水线/夜班三种无人值守形态。2026 年 8 月 11 日上线，8 月 21 日扩权降价，目前处于 beta 阶段，迭代极快。",
      "website_url": "https://grokbot.aihuangshu.com/",
      "open_source_url": null,
      "xian_url": "https://xian.app/products/47aa80e6-4927-4dd4-b332-5e459b1ccc48",
      "creator": { "name": "Indie Radar", "avatar_url": "https://xian.app/avatars/collectors/collector-12.webp" },
      "categories": [{ "name": "开发辅助", "slug": "skill" }],
      "cover_image": "https://pub-6030d398b27d47eba8aa3410cdcc9d05.r2.dev/c011ec70-0012-4000-8000-000000000012/47aa80e6-4927-4dd4-b332-5e459b1ccc48/1788245424067-0wsjwd.webp",
      "screenshots": ["https://pub-6030d398b27d47eba8aa3410cdcc9d05.r2.dev/c011ec70-0012-4000-8000-000000000012/47aa80e6-4927-4dd4-b332-5e459b1ccc48/1788245424067-0wsjwd.webp", "https://pub-6030d398b27d47eba8aa3410cdcc9d05.r2.dev/c011ec70-0012-4000-8000-000000000012/47aa80e6-4927-4dd4-b332-5e459b1ccc48/1788245424696-wnfnno.webp"],
      "created_at": "2026-09-01T06:50:23.86014+00:00",
      "updated_at": "2026-09-01T06:50:23.86014+00:00"
    },
    {
      "id": "d76bbb09-4dd5-4281-bddb-c13871ab5c48",
      "name": "乔木推荐",
      "tagline": "精选 AI 工具导航，一页看清优势",
      "description": "乔木推荐是一个精选 AI 工具导航站，收录朋友们的 AI 产品、效率工具和乔木自有工具站。页面提供分类筛选，涵盖 AI 创作、Agent、编程、设计、视频等方向，并附有用法简介和适用人群说明，帮助用户快速找到合适的工具。",
      "website_url": "https://tuijian.qiaomu.ai/",
      "open_source_url": null,
      "xian_url": "https://xian.app/products/d76bbb09-4dd5-4281-bddb-c13871ab5c48",
      "creator": { "name": "向阳乔木", "avatar_url": "https://xian.app/avatars/creators/vista8.jpg" },
      "categories": [{ "name": "效率工具", "slug": "productivity" }],
      "cover_image": "https://pub-6030d398b27d47eba8aa3410cdcc9d05.r2.dev/c0ffee00-0008-4000-8000-000000000002/d76bbb09-4dd5-4281-bddb-c13871ab5c48/1786162637292-guxy1g.webp",
      "screenshots": ["https://pub-6030d398b27d47eba8aa3410cdcc9d05.r2.dev/c0ffee00-0008-4000-8000-000000000002/d76bbb09-4dd5-4281-bddb-c13871ab5c48/1786162637292-guxy1g.webp"],
      "created_at": "2026-08-08T04:17:17.195416+00:00",
      "updated_at": "2026-08-08T04:17:17.195416+00:00"
    },
    {
      "id": "2bde4b36-fbdf-4420-9f73-09d46909c244",
      "name": "CodePilot",
      "tagline": "连接任意 AI 服务商的桌面端 Claude Code 工作空间",
      "description": "CodePilot 是一款开源的桌面 AI Agent 客户端，支持连接 Anthropic、OpenAI、智谱、Kimi 等 17+ 服务商，用户需自备 API Key，数据直连 Provider 不经过中间服务器。支持多会话独立运行、Code/Plan/Ask 三种模式、MCP 扩展、Skills 提示复用、权限确认机制及会话持久化，适用于 macOS、Windows 和 Linux 平台。",
      "website_url": "https://www.codepilot.sh/zh",
      "open_source_url": "https://github.com/op7418/CodePilot",
      "xian_url": "https://xian.app/products/2bde4b36-fbdf-4420-9f73-09d46909c244",
      "creator": { "name": "歸藏(guizang.ai)", "avatar_url": "https://xian.app/avatars/creators/op7418.jpg" },
      "categories": [{ "name": "AI工具", "slug": "ai-tools" }, { "name": "开发工具", "slug": "dev-tools" }],
      "cover_image": "https://pub-6030d398b27d47eba8aa3410cdcc9d05.r2.dev/c0ffee00-0741-4000-8000-000000000001/2bde4b36-fbdf-4420-9f73-09d46909c244/1786161371584-qalmmg.webp",
      "screenshots": ["https://pub-6030d398b27d47eba8aa3410cdcc9d05.r2.dev/c0ffee00-0741-4000-8000-000000000001/2bde4b36-fbdf-4420-9f73-09d46909c244/1786161371407-gnyi22.webp", "https://pub-6030d398b27d47eba8aa3410cdcc9d05.r2.dev/c0ffee00-0741-4000-8000-000000000001/2bde4b36-fbdf-4420-9f73-09d46909c244/1786161371584-qalmmg.webp"],
      "created_at": "2026-08-08T03:56:11.303903+00:00",
      "updated_at": "2026-08-08T03:56:11.303903+00:00"
    },
    {
      "id": "a3aaf2b4-9686-49d5-945d-2c914b550f5a",
      "name": "guizang-social-card-skill",
      "tagline": "一句话生成有设计感的社交媒体卡片",
      "description": "歸藏制作的社交媒体卡片生成 Skill，用 Agent 根据内容自动完成信息提炼、版式组织和视觉卡片生成，适合做 X、小红书、公众号等平台的知识卡片和内容配图。",
      "website_url": "https://github.com/op7418/guizang-social-card-skill",
      "open_source_url": "https://github.com/op7418/guizang-social-card-skill",
      "xian_url": "https://xian.app/products/a3aaf2b4-9686-49d5-945d-2c914b550f5a",
      "creator": { "name": "歸藏(guizang.ai)", "avatar_url": "https://xian.app/avatars/creators/op7418.jpg" },
      "categories": [{ "name": "优秀SKILL", "slug": "excellent-skill" }],
      "cover_image": "https://pub-6030d398b27d47eba8aa3410cdcc9d05.r2.dev/f352ec2c-c0e7-4cca-9cb2-13fb2944cbab/a3aaf2b4-9686-49d5-945d-2c914b550f5a/1786239633053-d95xeg.webp",
      "screenshots": ["https://pub-6030d398b27d47eba8aa3410cdcc9d05.r2.dev/f352ec2c-c0e7-4cca-9cb2-13fb2944cbab/a3aaf2b4-9686-49d5-945d-2c914b550f5a/1786239633053-d95xeg.webp"],
      "created_at": "2026-08-07T10:35:30.508568+00:00",
      "updated_at": "2026-08-09T01:40:33.344+00:00"
    },
    {
      "id": "64a527d6-3942-48b3-8d3d-e6eec2976578",
      "name": "qiaomu-icon-generator",
      "tagline": "让 Codex 一句话生成 App 和网页图标",
      "description": "向阳乔木开源的图标生成 Skill，让 Codex 根据产品描述快速生成 App、网页和项目图标。它既可以调用图像模型生成，也可以从大量 SVG 图标中检索并组合背景，适合 Vibe Coding 原型阶段快速补齐视觉资产。",
      "website_url": "https://github.com/joeseesun/qiaomu-icon-generator",
      "open_source_url": "https://github.com/joeseesun/qiaomu-icon-generator",
      "xian_url": "https://xian.app/products/64a527d6-3942-48b3-8d3d-e6eec2976578",
      "creator": { "name": "向阳乔木", "avatar_url": "https://xian.app/avatars/creators/vista8.jpg" },
      "categories": [{ "name": "优秀SKILL", "slug": "excellent-skill" }],
      "cover_image": "https://pub-6030d398b27d47eba8aa3410cdcc9d05.r2.dev/f352ec2c-c0e7-4cca-9cb2-13fb2944cbab/64a527d6-3942-48b3-8d3d-e6eec2976578/1786239730875-6ojxlw.webp",
      "screenshots": ["https://pub-6030d398b27d47eba8aa3410cdcc9d05.r2.dev/f352ec2c-c0e7-4cca-9cb2-13fb2944cbab/64a527d6-3942-48b3-8d3d-e6eec2976578/1786239730875-6ojxlw.webp"],
      "created_at": "2026-08-07T10:35:30.508568+00:00",
      "updated_at": "2026-08-09T01:42:11.176+00:00"
    },
    {
      "id": "a176cb59-8f85-43fb-8258-9b4c48a2dc13",
      "name": "qiaomu-cut-skill",
      "tagline": "一句话让 AI 自动找素材并剪成视频",
      "description": "向阳乔木制作的视频自动剪辑 Skill，可以调用 ListenHub CLI 和 Pexels 等素材源，根据文案自动寻找匹配的视频片段、组织素材并完成剪辑流程，用于快速制作短视频和内容视频。",
      "website_url": "https://github.com/joeseesun/qiaomu-cut-skill",
      "open_source_url": "https://github.com/joeseesun/qiaomu-cut-skill",
      "xian_url": "https://xian.app/products/a176cb59-8f85-43fb-8258-9b4c48a2dc13",
      "creator": { "name": "向阳乔木", "avatar_url": "https://xian.app/avatars/creators/vista8.jpg" },
      "categories": [{ "name": "优秀SKILL", "slug": "excellent-skill" }],
      "cover_image": "https://pub-6030d398b27d47eba8aa3410cdcc9d05.r2.dev/f352ec2c-c0e7-4cca-9cb2-13fb2944cbab/a176cb59-8f85-43fb-8258-9b4c48a2dc13/1786239708290-kyy9da.webp",
      "screenshots": ["https://pub-6030d398b27d47eba8aa3410cdcc9d05.r2.dev/f352ec2c-c0e7-4cca-9cb2-13fb2944cbab/a176cb59-8f85-43fb-8258-9b4c48a2dc13/1786239708290-kyy9da.webp"],
      "created_at": "2026-08-07T10:35:30.508568+00:00",
      "updated_at": "2026-08-09T01:41:48.559+00:00"
    },
    {
      "id": "183252bb-7df5-46db-a803-411b069d4b5a",
      "name": "Humanizer-zh",
      "tagline": "去掉 AI 写作里最明显的套路感",
      "description": "歸藏开源的中文文本去 AI 味 Skill，专门识别并修改 AI 生成内容中常见的套路表达、机械句式和营销腔。它把常见的 AI 痕迹拆成可检查的规则，再分阶段处理文本，适合润色文章、周报、营销文案和社交媒体内容。",
      "website_url": "https://github.com/op7418/Humanizer-zh",
      "open_source_url": "https://github.com/op7418/Humanizer-zh",
      "xian_url": "https://xian.app/products/183252bb-7df5-46db-a803-411b069d4b5a",
      "creator": { "name": "歸藏(guizang.ai)", "avatar_url": "https://xian.app/avatars/creators/op7418.jpg" },
      "categories": [{ "name": "优秀SKILL", "slug": "excellent-skill" }],
      "cover_image": "https://pub-6030d398b27d47eba8aa3410cdcc9d05.r2.dev/f352ec2c-c0e7-4cca-9cb2-13fb2944cbab/183252bb-7df5-46db-a803-411b069d4b5a/1786239660851-4gnt5a.webp",
      "screenshots": ["https://pub-6030d398b27d47eba8aa3410cdcc9d05.r2.dev/f352ec2c-c0e7-4cca-9cb2-13fb2944cbab/183252bb-7df5-46db-a803-411b069d4b5a/1786239660851-4gnt5a.webp"],
      "created_at": "2026-08-07T10:35:30.508568+00:00",
      "updated_at": "2026-08-09T01:41:01.367+00:00"
    },
    {
      "id": "66e56ce6-2959-4531-9d17-a9111db0dee2",
      "name": "Gety",
      "tagline": "让本地文件成为 AI Agent 随时可用的上下文",
      "description": "Gety 是 Listary 团队打造的本地文件搜索工具，把全文搜索、语义检索、OCR 和文档预览放在一起。它不仅能帮你快速找回电脑里的 PDF、Word、PPT、Excel、截图等内容，还能通过 MCP、API 和 CLI 把相关文件片段提供给 Claude、Codex、OpenClaw、Cursor 等 AI 工具。索引与搜索主要在本地完成，文件内容只有在你允许时才会分享给 AI。",
      "website_url": "https://gety.ai/zh/",
      "open_source_url": null,
      "xian_url": "https://xian.app/products/66e56ce6-2959-4531-9d17-a9111db0dee2",
      "creator": { "name": "产品松鼠", "avatar_url": "https://xian.app/avatars/collectors/collector-03.webp" },
      "categories": [{ "name": "AI工具", "slug": "ai-tools" }, { "name": "效率工具", "slug": "productivity" }],
      "cover_image": "https://pub-6030d398b27d47eba8aa3410cdcc9d05.r2.dev/f352ec2c-c0e7-4cca-9cb2-13fb2944cbab/66e56ce6-2959-4531-9d17-a9111db0dee2/1786098588451-42z0cv.webp",
      "screenshots": ["https://gety.ai/images/home/chatapp.png", "https://gety.ai/images/home/ppt-slide-3.png", "https://pub-6030d398b27d47eba8aa3410cdcc9d05.r2.dev/f352ec2c-c0e7-4cca-9cb2-13fb2944cbab/66e56ce6-2959-4531-9d17-a9111db0dee2/1786098588451-42z0cv.webp"],
      "created_at": "2026-08-07T10:04:51.925113+00:00",
      "updated_at": "2026-08-07T10:29:48.829+00:00"
    },
    {
      "id": "9bf717ae-e9eb-4efd-bd10-02047daf7764",
      "name": "侨批生成器",
      "tagline": "《给阿嫱的情书》灵感写一封跨越时代的家书",